{
  "name": "Tabs",
  "description": "다른 탭 간에 전환과 이동을 쉽게 할 수 있는 요소입니다.",
  "thumbnail": "../../comingSoon.png",
  "primitive": "../../primitive/tabs/primitive-meta.json",
  "platform": {
    "ios": {
      "status": "todo",
      "alias": "",
      "path": ""
    },
    "android": {
      "status": "todo",
      "path": ""
    },
    "react": {
      "status": "done",
      "path": "https://sprout-storybook.vercel.app/?path=/docs/components-tabs--docs"
    },
    "figma": {
      "status": "todo",
      "path": ""
    },
    "docs": {
      "overview": {
        "status": "in-progress",
        "storybook": {
          "path": "https://sprout-storybook.vercel.app/iframe.html?args=&id=components-tabs--basic&viewMode=story",
          "height": "300px"
        },
        "mdx": "./overview.mdx"
      },
      "usage": {
        "status": "in-progress",
        "mdx": "./usage.mdx"
      },
      "style": {
        "status": "done",
        "mdx": "./style.mdx"
      }
    }
  }
}
