{
  "name": "Snackbar",
  "description": "사용자의 특정 액션에 대한 피드백을 제공합니다.",
  "thumbnail": "./thumbnail.png",
  "primitive": "../../primitive/snackbar/primitive-meta.json",
  "platform": {
    "ios": {
      "status": "in-progress",
      "alias": "",
      "path": ""
    },
    "android": {
      "status": "todo",
      "path": ""
    },
    "react": {
      "status": "done",
      "path": "https://sprout-storybook.vercel.app/?path=/docs/components-snackbar--docs"
    },
    "figma": {
      "status": "todo",
      "path": ""
    },
    "docs": {
      "overview": {
        "status": "in-progress",
        "storybook": {
          "path": "https://sprout-storybook.vercel.app/iframe.html?args=&id=components-snackbar--basic&viewMode=story",
          "height": "300px"
        },
        "mdx": "./overview.mdx"
      },
      "usage": {
        "status": "in-progress",
        "mdx": "./usage.mdx"
      },
      "style": {
        "status": "done",
        "mdx": "./style.mdx"
      }
    }
  }
}
